Country, Publication_Date,Title,URL
QAT,2021-07-06,"Qatar Airways trials vaccine verification via IATA Travel Pass","https://www.ttgasia.com/2021/07/06/qatar-airways-trials-vaccine-verification-via-iata-travel-pass/"
QAT,2021-06-29,"Qatar Charity provides the Corona vaccine to the displaced in northern Syria","https://reliefweb.int/report/syrian-arab-republic/qatar-charity-provides-corona-vaccine-displaced-northern-syria"
QAT,2021-06-24,"Qatar pledges one million Covid-19 vaccine doses to Pakistan","https://www.dawn.com/news/1631062/qatar-pledges-one-million-covid-19-vaccine-doses-to-pakistan"
QAT,2021-06-20,"Qatar to require fans at 2022 World Cup to be vaccinated","https://apnews.com/article/middle-east-qatar-international-soccer-world-cup-health-69308436bc8a11e3f1b7ad747492f7f3"
QAT,2021-06-17,"Covid-19 third wave not expected in Qatar: Dr al-Khal","https://www.gulf-times.com/story/694376/Covid-19-third-wave-not-expected-in-Qatar-Dr-al-Kh"
QAT,2021-06-13,"Qatari study reveals effectiveness of vaccination, prior infection in preventing Covid-19", "https://thepeninsulaqatar.com/article/13/06/2021/Qatari-study-reveals-effectiveness-of-vaccination,-prior-infection-in-preventing-Covid-19"
QAT,2021-06-02,"Qatar supports the COVAX facility to accelerate global access to COVID19 vaccines: Minister of Public Health", "https://thepeninsulaqatar.com/article/02/06/2021/Qatar-supports-the-COVAX-facility-to-accelerate-global-access-to-COVID19-vaccines-Minister-of-Public-Health"
QAT,2021-05-31,"Qatar confronts Covid-19 with largest vaccination campaign in its history", "https://www.thepeninsulaqatar.com/article/31/05/2021/Qatar-confronts-Covid-19-with-largest-vaccination-campaign-in-its-history"
QAT,2021-05-03,"Nearly 45% Qatar’s eligible population receive at least one Covid-19 dose", "https://www.dohanews.co/nearly-45-qatars-eligible-population-receive-at-least-one-covid-19-dose/"
